### ISSUE TITLE
Weird routing behavior on mode="bridge" when trying to reach alloc on same host.

### ISSUE THREAD

**Issue by mashedmonday** [hashicorp/nomad#24648]
### Nomad version
Nomad v1.8.3
BuildDate 2024-08-13T07:37:30Z
Revision 63b636e5cbaca312cf6ea63e040f445f05f00478

### Operating system and Environment details
* CNI v0.8.5
* Linux
* cloud-init
* no consul-connect
* 3 node cluster

### Issue

I am deploying a mongo replica with 3 nodes on 3 different hosts.

When deploying a busybox through docker/bridge on the same hosts and enter the allocation, I can wget on mongo on all allocations **except** the allocation that is on the same host.

### Reproduction steps

Once I understand what's needed I am happy to share HCL, cloud-init or server configs, just don't want to paste it all unnecessarily.

**nomad.hcl**
```HCL
log_level = "INFO"
enable_syslog = true
datacenter="fin1"
data_dir="/var/lib/nomad"
bind_addr = "{{ GetInterfaceIP \"enp7s0\" }}"
advertise {
  http = "{{ GetInterfaceIP \"enp7s0\" }}"
}
consul {
  address="127.0.0.1:8500"
  # Enables automatically registering the services.
  auto_advertise = true
  # Enabling the server and client to bootstrap using Consul.
  server_auto_join = true
  client_auto_join = true
  # auto register the services
  auto_advertise = true
  server_service_name = "nomad-servers"
  client_service_name = "nomad-clients"
  tags = ["traefik.enable=true"]
}
client {
  enabled = true

  # This results in "bridge"-ed ports to only be accessible in private network
  # The default would have been to pick the public interface!
  network_interface = "enp7s0"

  server_join {
    retry_join = ["10.0.2.2"]
  }
  servers = ["10.0.2.2:4646"]
  options {
    docker.privileged.enabled = true
    driver.raw_exec.enable = true
  }
  
  meta {}
}
server {
  enabled = true
  bootstrap_expect=2
  encrypt = ""
  server_join {
    retry_join = ["10.0.2.2"]
  }
  rejoin_after_leave = false
}
telemetry {
  collection_interval = "5s"
  disable_hostname = false
  prometheus_metrics = true
  publish_allocation_metrics = true
  publish_node_metrics = true

}
plugin "docker" {
    config {
        allow_privileged = true
        volumes {
            enabled = true
        }
        # Extra Docker labels to be added within their Docker plugin stanza, in order to facilitate logs filtering:
        extra_labels = ["job_name", "job_id", "task_group_name", "task_name", "namespace", "node_name", "node_id"]
    }
}
acl {
  enabled = true
}

vault {
  enabled = true
  token = ""
  address = "http://active.vault.service.consul:8200"
}

```

#### Expected Result

Any allocation can reach any other allocation irrespective of their distribution across hosts.

#### Actual Result

I cannot reach allocations that are on the same host.

### Job file (if appropriate)

```hcl
variable "domain" {
  type = string
}

job "mongo" {
  type        = "service"
  datacenters = ["fin1"]
  update {
    max_parallel      = 1
    health_check      = "checks"
    min_healthy_time  = "180s"
    healthy_deadline  = "15m"
    progress_deadline = "20m"
    #auto_revert       = true
    #auto_promote      = true
    #canary            = 1
  }

  constraint {
    operator  = "distinct_hosts"
    value     = "true"
  }
  group "mongo-primary" {
    count = 1

    network {
      mode = "bridge"
      port "mongo" {
        static = 27027
      }
    }

    volume "mongo" {
      type            = "csi"
      read_only       = false
      source          = "mongo-primary-vol"
      attachment_mode = "file-system"
      access_mode     = "single-node-writer"
      per_alloc       = true
    }

    service {
      name = "mongodb"
      port = "mongo"
    }

    service {
      name = "mongo-primary"
      port = "mongo"
      tags = [
        "${NOMAD_ALLOC_INDEX}",
      ]
    }

    task "mongo" {
      driver = "docker"

      volume_mount {
        volume      = "mongo"
        destination = "/bitnami"
        read_only   = false
      }

      config {
        image = "bitnami/mongodb:7.0.14"        
        # This is needed due to a bug in MONGODB_ADVERTISED_HOSTNAME
        extra_hosts = [
          "mongo-primary:127.0.0.1",
          "mongo-primary.service.consul:127.0.0.1",

          "${NOMAD_ALLOC_INDEX}.mongo-primary.service.consul:127.0.0.1",
        ]
      }

      env {
        MONGODB_EXTRA_FLAGS            = "--bind_ip_all"
        MONGODB_REPLICA_SET_MODE       = "primary"
        MONGODB_SYSTEM_LOG_VERBOSITY   = 0
        MONGODB_ADVERTISED_HOSTNAME    = "mongo-primary.service.consul"
        MONGODB_ADVERTISED_PORT_NUMBER = "${NOMAD_PORT_mongo}"
        MONGODB_PORT_NUMBER            = "${NOMAD_PORT_mongo}"
      }

      vault {
        policies = ["mongo-root"]
        change_mode = "noop"
      }

      template {
        data        = <<-EOF
          {{with secret "secrets/data/mongo/root"}}
          {{ range $k, $v := .Data.data }}
          {{ $k }}={{ $v }}
          {{ end }}{{ end }}
          EOF
        destination = "secrets/config.env"
        env         = true
      }

      resources {
        cpu    = 1024
        memory = 8000
      }
    }
  }
  group "mongo-replica" {
    count = 1
    network {
      mode = "bridge"
      port "mongo" {
        static = 27028
      }
    }

    service {
      name = "mongodb"
      port = "mongo"
    }

    service {
      name = "mongo-secondary"
      port = "mongo"
      tags = [
        "${NOMAD_ALLOC_INDEX}",
      ]
    }

    volume "mongo" {
      type            = "csi"
      read_only       = false
      source          = "mongo-replica-vol"
      attachment_mode = "file-system"
      access_mode     = "single-node-writer"
      per_alloc       = true
    }

    task "mongo" {
      driver = "docker"

      volume_mount {
        volume      = "mongo"
        destination = "/bitnami"
        read_only   = false
      }

      config {
        image = "bitnami/mongodb:7.0.14"
        extra_hosts = [
          "${NOMAD_ALLOC_INDEX}.mongo-secondary.service.consul:127.0.0.1",
        ]
      }

      env {
        MONGODB_EXTRA_FLAGS               = "--bind_ip_all"
        MONGODB_REPLICA_SET_MODE          = "secondary"
        MONGODB_SYSTEM_LOG_VERBOSITY      = 0
        MONGODB_INITIAL_PRIMARY_HOST      = "mongo-primary.service.consul"
        MONGODB_INITIAL_PRIMARY_ROOT_USER = "root"
        MONGODB_ADVERTISED_HOSTNAME       = "${NOMAD_ALLOC_INDEX}.mongo-secondary.service.consul"
        MONGODB_ADVERTISED_PORT_NUMBER    = "${NOMAD_PORT_mongo}"
        MONGODB_PORT_NUMBER               = "${NOMAD_PORT_mongo}"
      }

      vault {
        policies = ["mongo-replica"]
        change_mode = "noop"
      }

      template {
        data        = <<-EOF
          {{with secret "secrets/data/mongo/replica"}}
          {{ range $k, $v := .Data.data }}
          {{ $k }}={{ $v }}
          {{ end }}{{ end }}

          {{ with service "mongo-primary" }}{{ with index . 0 }}
          MONGODB_INITIAL_PRIMARY_PORT_NUMBER = "{{ .Port }}"
          {{ end }}{{ end }}
          EOF
        destination = "secrets/config.env"
        env         = true
        change_mode = "noop"
      }

      resources {
        cpu    = 1024
        memory = 4096
      }
    }
  }
}

```

```HCL
job "box" {
  type        = "service"
  datacenters = ["fin1"]
  constraint {
    operator  = "distinct_hosts"
    value     = "true"
  }
  group "box" {
    count = 3
    network {
      mode = "bridge"
      port "exporter" {}
    }

    task "busyboy" {
      driver = "docker"
      config {
        image        = "busybox:latest"
        command      = "sleep"
        args         = ["infinity"]
      }
      resources {
        cpu    = 200
        memory = 128
      }
    }
  }
}

```

Interestingly this happens when i am trying to wget on the mongoport on an allocation **not** on my current host:

```
10:32:37.718689 IP 172.26.64.45.41504 > 172.17.0.1.53: 64540+ A? mongo-secondary.service.consul. (48)
10:32:37.718765 IP 172.26.64.45.41504 > 172.17.0.1.53: 44825+ AAAA? mongo-secondary.service.consul. (48)
10:32:37.719935 IP 172.17.0.1.53 > 172.26.64.45.41504: 44825* 0/1/0 (98)
10:32:37.720144 IP 172.17.0.1.53 > 172.26.64.45.41504: 64540* 1/0/0 A 10.0.2.3 (64)                                                          10:32:37.720414 IP 172.26.64.45.50758 > 10.0.2.3.27028: Flags [S], seq 2137791456, win 64240, options [mss 1460,sackOK,TS val 1680059192 ecr
0,nop,wscale 7], length 0
10:32:37.721195 IP 10.0.2.3.27028 > 172.26.64.45.50758: Flags [S.], seq 3259786487, ack 2137791457, win 65160, options [mss 1460,sackOK,TS va
l 3708063150 ecr 1680059192,nop,wscale 7], length 0
10:32:37.721268 IP 172.26.64.45.50758 > 10.0.2.3.27028: Flags [.], ack 1, win 502, options [nop,nop,TS val 1680059193 ecr 3708063150], length 0
10:32:37.721474 IP 172.26.64.45.50758 > 10.0.2.3.27028: Flags [P.], seq 1:100, ack 1, win 502, options [nop,nop,TS val 1680059193 ecr 3708063
150], length 99
10:32:37.722214 IP 10.0.2.3.27028 > 172.26.64.45.50758: Flags [.], ack 100, win 509, options [nop,nop,TS val 3708063151 ecr 1680059193], leng
th 0
10:32:37.723635 IP 10.0.2.3.27028 > 172.26.64.45.50758: Flags [P.], seq 1:170, ack 100, win 509, options [nop,nop,TS val 3708063152 ecr 16800
59193], length 169
10:32:37.723669 IP 172.26.64.45.50758 > 10.0.2.3.27028: Flags [.], ack 170, win 501, options [nop,nop,TS val 1680059195 ecr 3708063152], leng
th 0
10:32:37.724017 IP 172.26.64.45.50758 > 10.0.2.3.27028: Flags [F.], seq 100, ack 170, win 501, options [nop,nop,TS val 1680059195 ecr 3708063
152], length 0
10:32:37.724304 IP 10.0.2.3.27028 > 172.26.64.45.50758: Flags [F.], seq 170, ack 100, win 509, options [nop,nop,TS val 3708063153 ecr 1680059
193], length 0
10:32:37.724311 IP 10.0.2.3.27028 > 172.26.64.45.50758: Flags [R.], seq 171, ack 100, win 509, options [nop,nop,TS val 3708063153 ecr 1680059
193], length 0
10:32:37.724327 IP 172.26.64.45.50758 > 10.0.2.3.27028: Flags [.], ack 171, win 501, options [nop,nop,TS val 1680059196 ecr 3708063153], leng
th 0
10:32:37.726130 IP 10.0.2.3.27028 > 172.26.64.45.50758: Flags [R], seq 3259786657, win 0, length 0
10:32:37.726140 IP 10.0.2.3.27028 > 172.26.64.45.50758: Flags [R], seq 3259786657, win 0, length 0
10:32:37.726239 IP 10.0.2.3.27028 > 172.26.64.45.50758: Flags [R], seq 3259786658, win 0, length 0
```

I have `10.0.2.x` <> `172.26.64.x` talking.

While, trying to wget on the mongo allocation on the same host, I am getting stuck (no refuse, no nothing, connection just hangs):

```
10:32:45.903496 IP 172.26.64.45.59110 > 172.17.0.1.53: 33541+ A? mongo-primary.service.consul. (46)
10:32:45.903597 IP 172.26.64.45.59110 > 172.17.0.1.53: 36366+ AAAA? mongo-primary.service.consul. (46)
10:32:45.904695 IP 172.17.0.1.53 > 172.26.64.45.59110: 36366* 0/1/0 (96)
10:32:45.904783 IP 172.17.0.1.53 > 172.26.64.45.59110: 33541* 1/0/0 A 10.0.2.4 (62)
10:32:45.904876 IP 172.26.64.45.52420 > 10.0.2.4.27027: Flags [S], seq 4183036886, win 64240, options [mss 1460,sackOK,TS val 3051606445 ecr
0,nop,wscale 7], length 0
10:32:45.904960 IP 172.26.64.43.27027 > 172.26.64.45.52420: Flags [S.], seq 1386574487, ack 4183036887, win 65160, options [mss 1460,sackOK,T
S val 2054242208 ecr 3051606445,nop,wscale 7], length 0
10:32:45.904968 IP 172.26.64.45.52420 > 172.26.64.43.27027: Flags [R], seq 4183036887, win 0, length 0
10:32:46.933131 IP 172.26.64.45.52420 > 10.0.2.4.27027: Flags [S], seq 4183036886, win 64240, options [mss 1460,sackOK,TS val 3051607474 ecr
0,nop,wscale 7], length 0
10:32:46.933272 IP 172.26.64.43.27027 > 172.26.64.45.52420: Flags [S.], seq 1402641841, ack 4183036887, win 65160, options [mss 1460,sackOK,T
S val 2054243237 ecr 3051607474,nop,wscale 7], length 0
10:32:46.933286 IP 172.26.64.45.52420 > 172.26.64.43.27027: Flags [R], seq 4183036887, win 0, length 0
```

I have `172.26.64.x` <> `172.26.64.x` talking which might not be what wget expects?!

**Comment by mashedmonday** [comment]
Worth noting, I have another cluster consisting of 3 machines, where i have a similar behavior but **only** get the problem on one particular host, not the others. Even though they are all spun up from pretty much the same image.

**Comment by tgross** [comment]
Hi @mashedmonday!

I see you've got `network_interface = "enp7s0"` and that's the interface for `advertise.http` and `bind_addr` as well. In the example same-host request you're showing, there are a few different addresses at play. Can you confirm my understanding of what I'm seeing here?

* `172.26.64.45` is the busybox container's IP.
* `172.17.0.1:53` is your DNS stub resolver (probably systemd-resolved). Is the stub resolver is configured to forward to Consul?
* `10.0.2.4` is the address advertised in DNS.
* `172.26.64.43` is the bridge address? Or the mongo container's IP?

My suspicion is that at some point you had another container running on this same port (even just restarting the alloc you've got would do it) and that for some reason the iptables rules weren't cleaned up correctly (ref https://github.com/hashicorp/nomad/issues/18842). That could result in an iptables rule that's breaking NAT across the bridge in an unexpected way. Do any of the rules found in `iptables -L -t nat` look potentially interesting there?

**Comment by mashedmonday** [comment]
Hi @tgross,
thanks for getting back to me so quickly. Much appreciate it.

Let me start with, I relaxed our production deployment by going for `config->network_mode: host` with docker so i avoid the problems an can investigate with some piece in mind :D


> Can you confirm my understanding of what I'm seeing here?

Yes, your observations are correct

> My suspicion is that at some point you had another container running on this same port (even just restarting the alloc you've got would do it)

Given that i use static ports here, that could very well be the case. 



> Do any of the rules found in `iptables -L -t nat` look potentially interesting there?

I'll keep an eye open, but sofar, I cannot see any of it.

Also, in my case, I can reproduce this 100% of the time. Not sure an accidental leftover iptables rule would cause this.

Do you mind explaining to me if (and how) routing is different for an allocation that talks to another allocation **but on the same host**? What iptables rule would apply here?

**Comment by mashedmonday** [comment]
What's interesting and probably related, I have a postgres allocation, also with 

```
    network {
      mode = "bridge"
      port "postgres" {
        static = 5432
      }
    }
```

That runs on my host **jump**. When i open a tunnel to postgres through ssh like so:

```
ssh -N -L 5432:postgres.service.consul:5432 root@jump.xxxxxxxx
```

I get the same behavior locally, e.g. my packages from/to the allocation are being dropped (probably). A pg_dump would just get stuck.

**Comment by tgross** [comment]
Ok, thanks for that. But there was one unanswered question there:
> 172.26.64.43 is the bridge address? Or the mongo container's IP?

Everything I've seen so far shows you're using Consul DNS to resolve an address, but if this is the bridge address and not the allocation address (I'm not sure how that'd happen, but I'm trying to start with symptoms before moving to diagnosis :grin: ), then you wouldn't be able make a request from an allocation on the same node (unless you've got [`client.bridge_network_hairpin_mode`](https://developer.hashicorp.com/nomad/docs/configuration/client#bridge_network_hairpin_mode) on, IIRC).

So what I'm trying to get at is if the Consul DNS IP address matches what you see when you do `nomad alloc status $allocid` for the alloc you're trying to reach.

**Comment by tgross** [comment]
Ok yeah all that sounds correct then. The exposed address should be the `bind_addr` (or the [`client.network_interface`](https://developer.hashicorp.com/nomad/docs/configuration/client#network_interface), which is the same here), and that's what you should be using and should be seeing in Consul. So that all looks fine... which is a puzzle because clearly it's _not_ fine. :frowning: 

> I have never heard of `bridge_network_hairpin_mode` before. Looks interesting but I am not sure this is what I would want to do.

Yeah, I agree. That's a pretty esoteric option and shouldn't be necessary (I've verified that here).

If there's nothing obvious to you in the iptables rules or in `ip link`, and you've verified the host is configured correct (ref https://developer.hashicorp.com/nomad/docs/install/production/requirements#bridge-networking-and-iptables), then at this point I'd probably `tcpdump` on the bridge and the veth interfaces of the target task, and/or look at packet counts via iptables:
* `sudo iptables -Z` to zero the counters
* `sudo iptables -vnL -t nat` and `sudo iptables -vnL` before-and-after

**Comment by mashedmonday** [comment]
Hey,

let me start with, I appreciate the assistance.

In my opening post, there already is a tcpdump to a remote host and one to the local host which shows that packages are routed via the docker bridge and not over the host's NIC (10.x.x.x), from what I understand.

I ma happy to tcpdump some more asap. Can you tell me what I am looking foe or what I should test out ?

**Comment by tgross** [comment]
> In my opening post, there already is a tcpdump to a remote host and one to the local host which shows that packages are routed via the docker bridge and not over the host's NIC (10.x.x.x), from what I understand.

Oh, sorry, this tcpdump was attached to the bridge interface? Then those iptables counters are where I'd look next.

You might also make get some insight with `bpftrace`'s [`tcpdrop.bt`](https://github.com/bpftrace/bpftrace/blob/master/tools/tcpdrop.bt) as well, if you have the capability to run that in your environment (and potentially make adjustments for your kernel version, unfortunately). If you use that successfully and send it to the write-only nomad-oss-debug@hashicorp.com mailing list I may be able to help you decipher the output.

**Comment by mashedmonday** [comment]
> Oh, sorry, this tcpdump was attached to the bridge interface? Then those iptables counters are where I'd look next.

I have some more information:

<details>

<summary>nginx.hcl</summary>

```HCL
job "nginx" {
  datacenters = ["fin1"]
  type        = "service"

  constraint {
    distinct_hosts = true
  }

  group "app" {
    count = 3

    network {
      mode = "bridge"
      port "http" {
        to = 80
      }
    }
    task "app" {
      driver = "docker"
      config {
        image = "nginx"
      }
      resources {
        cpu    = 200 # 200 MHz
        memory = 32  #  32 MB
      }
    }
  }
}
```

</details>

<details>

<summary>busybox.hcl</summary>

```HCL
job "box" {
  type        = "service"
  datacenters = ["fin1"]
  constraint {
    operator  = "distinct_hosts"
    value     = "true"
  }
  group "box" {
    count = 3
    network {
      mode = "bridge"
      port "exporter" {}
    }

    task "busyboy" {
      driver = "docker"
      config {
        image        = "busybox:latest"
        command      = "sleep"
        args         = ["infinity"]
      }
      resources {
        cpu    = 200
        memory = 128
      }
    }
  }
}
```

</details>

With these, I busybox instances, I can reproducably reach nginx instances that are **not** on the same allocation:

<details>

<summary>nginx allocation: </summary>

```
ID                  = ee02a85e-8a35-fd38-085b-d4183dfbf518
Eval ID             = f7313680
Name                = nginx.app[0]
Node ID             = 3ed7fb78
Node Name           = idea
Job ID              = nginx
Job Version         = 0
Client Status       = running
Client Description  = Tasks are running
Desired Status      = run
Desired Description = <none>
Created             = 18m43s ago
Modified            = 18m27s ago
Deployment ID       = bdd950a7
Deployment Health   = healthy

Allocation Addresses (mode = "bridge"):
Label  Dynamic  Address
*http  yes      10.0.2.4:30426 -> 80

Task "app" is "running"
Task Resources:
CPU        Memory         Disk     Addresses
0/200 MHz  13 MiB/32 MiB  300 MiB

Task Events:
Started At     = 2024-12-13T08:48:29Z
Finished At    = N/A
Total Restarts = 0
Last Restart   = N/A

Recent Events:
Time                       Type        Description
2024-12-13T09:48:29+01:00  Started     Task started by client
2024-12-13T09:48:24+01:00  Driver      Downloading image
2024-12-13T09:48:24+01:00  Task Setup  Building Task Directory
2024-12-13T09:48:23+01:00  Received    Task received by client

```

</details>

<details>

<summary>busybox allocation: </summary>

```
ID                  = 13bdeaab-5ada-a388-02df-2849ec244998
Eval ID             = bb4da9ea
Name                = box.box[0]
Node ID             = 3ed7fb78
Node Name           = idea
Job ID              = box
Job Version         = 0
Client Status       = running
Client Description  = Tasks are running
Desired Status      = run
Desired Description = <none>
Created             = 1d22h ago
Modified            = 1d22h ago
Deployment ID       = 62e34000
Deployment Health   = healthy

Allocation Addresses (mode = "bridge"):
Label      Dynamic  Address
*exporter  yes      10.0.2.4:24396

Task "busyboy" is "running"
Task Resources:
CPU        Memory           Disk     Addresses
0/200 MHz  888 KiB/128 MiB  300 MiB

Task Events:
Started At     = 2024-12-11T10:26:00Z
Finished At    = N/A
Total Restarts = 0
Last Restart   = N/A

Recent Events:
Time                       Type        Description
2024-12-11T11:26:00+01:00  Started     Task started by client
2024-12-11T11:25:58+01:00  Driver      Downloading image
2024-12-11T11:25:58+01:00  Task Setup  Building Task Directory
2024-12-11T11:25:57+01:00  Received    Task received by client
```

</details>

## Some more data on the nginx container:

<details>

<summary>docker inspect on nginx container</summary>
[
    {
        "Id": "99a28d583acdd6391531fad358279e809d4451358ae9a69c121ee08384574ac9",
        "Created": "2024-12-13T08:48:29.129240799Z",
        "Path": "/docker-entrypoint.sh",
        "Args": [
            "nginx",
            "-g",
            "daemon off;"
        ],
        "State": {
            "Status": "running",
            "Running": true,
            "Paused": false,
            "Restarting": false,
            "OOMKilled": false,
            "Dead": false,
            "Pid": 2874269,
            "ExitCode": 0,
            "Error": "",
            "StartedAt": "2024-12-13T08:48:29.197870184Z",
            "FinishedAt": "0001-01-01T00:00:00Z"
        },
        "Image": "sha256:66f8bdd3810c96dc5c28aec39583af731b34a2cd99471530f53c8794ed5b423e",
        "ResolvConfPath": "/var/lib/docker/containers/01cc15c7ef220e256fe2dc9188207fc97df56afaa5b5471ef48b396960ca17e9/resolv.conf",
        "HostnamePath": "/var/lib/docker/containers/01cc15c7ef220e256fe2dc9188207fc97df56afaa5b5471ef48b396960ca17e9/hostname",
        "HostsPath": "/var/lib/nomad/alloc/ee02a85e-8a35-fd38-085b-d4183dfbf518/hosts",
        "LogPath": "/var/lib/docker/containers/99a28d583acdd6391531fad358279e809d4451358ae9a69c121ee08384574ac9/99a28d583acdd6391531fad358279e809d4451358ae9a69c121ee08384574ac9-json.log",
        "Name": "/app-ee02a85e-8a35-fd38-085b-d4183dfbf518",
        "RestartCount": 0,
        "Driver": "overlay2",
        "Platform": "linux",
        "MountLabel": "",
        "ProcessLabel": "",
        "AppArmorProfile": "docker-default",
        "ExecIDs": null,
        "HostConfig": {
            "Binds": [
                "/var/lib/nomad/alloc/ee02a85e-8a35-fd38-085b-d4183dfbf518/alloc:/alloc",
                "/var/lib/nomad/alloc/ee02a85e-8a35-fd38-085b-d4183dfbf518/app/local:/local",
                "/var/lib/nomad/alloc/ee02a85e-8a35-fd38-085b-d4183dfbf518/app/secrets:/secrets"
            ],
            "ContainerIDFile": "",
            "LogConfig": {
                "Type": "json-file",
                "Config": {
                    "max-file": "2",
                    "max-size": "2m"
                }
            },
            "NetworkMode": "container:01cc15c7ef220e256fe2dc9188207fc97df56afaa5b5471ef48b396960ca17e9",
            "PortBindings": null,
            "RestartPolicy": {
                "Name": "no",
                "MaximumRetryCount": 0
            },
            "AutoRemove": false,
            "VolumeDriver": "",
            "VolumesFrom": null,
            "ConsoleSize": [
                0,
                0
            ],
            "CapAdd": null,
            "CapDrop": [
                "net_raw"
            ],
            "CgroupnsMode": "private",
            "Dns": null,
            "DnsOptions": null,
            "DnsSearch": null,
            "ExtraHosts": null,
            "GroupAdd": null,
            "IpcMode": "private",
            "Cgroup": "",
            "Links": null,
            "OomScoreAdj": 0,
            "PidMode": "",
            "Privileged": false,
            "PublishAllPorts": false,
            "ReadonlyRootfs": false,
            "SecurityOpt": null,
            "UTSMode": "",
            "UsernsMode": "",
            "ShmSize": 67108864,
            "Runtime": "runc",
            "Isolation": "",
            "CpuShares": 200,
            "Memory": 33554432,
            "NanoCpus": 0,
            "CgroupParent": "",
            "BlkioWeight": 0,
            "BlkioWeightDevice": null,
            "BlkioDeviceReadBps": null,
            "BlkioDeviceWriteBps": null,
            "BlkioDeviceReadIOps": null,
            "BlkioDeviceWriteIOps": null,
            "CpuPeriod": 0,
            "CpuQuota": 0,
            "CpuRealtimePeriod": 0,
            "CpuRealtimeRuntime": 0,
            "CpusetCpus": "",
            "CpusetMems": "",
            "Devices": null,
            "DeviceCgroupRules": null,
            "DeviceRequests": null,
            "MemoryReservation": 0,
            "MemorySwap": 33554432,
            "MemorySwappiness": null,
            "OomKillDisable": null,
            "PidsLimit": null,
            "Ulimits": null,
            "CpuCount": 0,
            "CpuPercent": 0,
            "IOMaximumIOps": 0,
            "IOMaximumBandwidth": 0,
            "Mounts": [
                {
                    "Type": "bind",
                    "Source": "/var/lib/nomad/alloc/ee02a85e-8a35-fd38-085b-d4183dfbf518/hosts",
                    "Target": "/etc/hosts",
                    "BindOptions": {
                        "Propagation": "private"
                    }
                }
            ],
            "MaskedPaths": [
                "/proc/asound",
                "/proc/acpi",
                "/proc/kcore",
                "/proc/keys",
                "/proc/latency_stats",
                "/proc/timer_list",
                "/proc/timer_stats",
                "/proc/sched_debug",
                "/proc/scsi",
                "/sys/firmware",
                "/sys/devices/virtual/powercap"
            ],
            "ReadonlyPaths": [
                "/proc/bus",
                "/proc/fs",
                "/proc/irq",
                "/proc/sys",
                "/proc/sysrq-trigger"
            ]
        },
        "GraphDriver": {
            "Data": {
                "LowerDir": "/var/lib/docker/overlay2/6fa9dc0c6327c41891ab968009b472f75382f05df534a824d8b51f0d45c32494-init/diff:/var/lib/docker/overlay2/bb5b2503ba87ca6336c4e0614731283d8a91f18fe4a75958029b6805af43c30f/diff:/var/lib/docker/overlay2/fd35c67cab4baa18a9be74c9d90942a3f44a9ef20806c33c81ffb721c1fd5d6c/diff:/var/lib/docker/overlay2/e0f9663ac21a3162c8739db344c48120feac103e018951a574952402d4f01882/diff:/var/lib/docker/overlay2/7a35b4d1fce11391e79cae4cff88205aadf3b36f838712cb6b34accb179868fc/diff:/var/lib/docker/overlay2/2c11af92c1e9684fc55de2143d7075b3ff2902f9f4ae0b433168a3d1d3a82c7a/diff:/var/lib/docker/overlay2/f02c5dbe8467cc67e47edf3640622cbccfa4027aa0b19560adce257c8fdb82fb/diff:/var/lib/docker/overlay2/bd951251326f5f0e579c69c7f9af50aea70d38307e8f2cf882c5c13dbe162bf6/diff",
                "MergedDir": "/var/lib/docker/overlay2/6fa9dc0c6327c41891ab968009b472f75382f05df534a824d8b51f0d45c32494/merged",
                "UpperDir": "/var/lib/docker/overlay2/6fa9dc0c6327c41891ab968009b472f75382f05df534a824d8b51f0d45c32494/diff",
                "WorkDir": "/var/lib/docker/overlay2/6fa9dc0c6327c41891ab968009b472f75382f05df534a824d8b51f0d45c32494/work"
            },
            "Name": "overlay2"
        },
        "Mounts": [
            {
                "Type": "bind",
                "Source": "/var/lib/nomad/alloc/ee02a85e-8a35-fd38-085b-d4183dfbf518/app/secrets",
                "Destination": "/secrets",
                "Mode": "",
                "RW": true,
                "Propagation": "rprivate"
            },
            {
                "Type": "bind",
                "Source": "/var/lib/nomad/alloc/ee02a85e-8a35-fd38-085b-d4183dfbf518/hosts",
                "Destination": "/etc/hosts",
                "Mode": "",
                "RW": true,
                "Propagation": "private"
            },
            {
                "Type": "bind",
                "Source": "/var/lib/nomad/alloc/ee02a85e-8a35-fd38-085b-d4183dfbf518/alloc",
                "Destination": "/alloc",
                "Mode": "",
                "RW": true,
                "Propagation": "rprivate"
            },
            {
                "Type": "bind",
                "Source": "/var/lib/nomad/alloc/ee02a85e-8a35-fd38-085b-d4183dfbf518/app/local",
                "Destination": "/local",
                "Mode": "",
                "RW": true,
                "Propagation": "rprivate"
            }
        ],
        "Config": {
            "Hostname": "01cc15c7ef22",
            "Domainname": "",
            "User": "",
            "AttachStdin": false,
            "AttachStdout": false,
            "AttachStderr": false,
            "ExposedPorts": {
                "80/tcp": {}
            },
            "Tty": false,
            "OpenStdin": false,
            "StdinOnce": false,
            "Env": [
                "NOMAD_ADDR_http=10.0.2.4:30426",
                "NOMAD_ALLOC_ADDR_http=172.26.64.109:80",
                "NOMAD_ALLOC_DIR=/alloc",
                "NOMAD_ALLOC_ID=ee02a85e-8a35-fd38-085b-d4183dfbf518",
                "NOMAD_ALLOC_INDEX=0",
                "NOMAD_ALLOC_INTERFACE_http=eth0",
                "NOMAD_ALLOC_IP_http=172.26.64.109",
                "NOMAD_ALLOC_NAME=nginx.app[0]",
                "NOMAD_ALLOC_PORT_http=80",
                "NOMAD_CPU_CORES= ",
                "NOMAD_CPU_LIMIT=200",
                "NOMAD_DC=fin1",
                "NOMAD_GROUP_NAME=app",
                "NOMAD_HOST_ADDR_http=10.0.2.4:30426",
                "NOMAD_HOST_IP_http=10.0.2.4",
                "NOMAD_HOST_PORT_http=30426",
                "NOMAD_IP_http=10.0.2.4",
                "NOMAD_JOB_ID=nginx",
                "NOMAD_JOB_NAME=nginx",
                "NOMAD_MEMORY_LIMIT=32",
                "NOMAD_NAMESPACE=default",
                "NOMAD_PARENT_CGROUP=nomad.slice",
                "NOMAD_PORT_http=80",
                "NOMAD_REGION=global",
                "NOMAD_SECRETS_DIR=/secrets",
                "NOMAD_SHORT_ALLOC_ID=ee02a85e",
                "NOMAD_TASK_DIR=/local",
                "NOMAD_TASK_NAME=app",
                "PATH=/usr/local/sbin:/usr/local/bin:/usr/sbin:/usr/bin:/sbin:/bin",
                "NGINX_VERSION=1.27.3",
                "NJS_VERSION=0.8.7",
                "NJS_RELEASE=1~bookworm",
                "PKG_RELEASE=1~bookworm",
                "DYNPKG_RELEASE=1~bookworm"
            ],
            "Cmd": [
                "nginx",
                "-g",
                "daemon off;"
            ],
            "Image": "nginx",
            "Volumes": null,
            "WorkingDir": "",
            "Entrypoint": [
                "/docker-entrypoint.sh"
            ],
            "OnBuild": null,
            "Labels": {
                "com.hashicorp.nomad.alloc_id": "ee02a85e-8a35-fd38-085b-d4183dfbf518",
                "com.hashicorp.nomad.job_id": "nginx",
                "com.hashicorp.nomad.job_name": "nginx",
                "com.hashicorp.nomad.namespace": "default",
                "com.hashicorp.nomad.node_id": "3ed7fb78-df5a-2a7f-5f2a-9015f5a738f9",
                "com.hashicorp.nomad.node_name": "idea",
                "com.hashicorp.nomad.task_group_name": "app",
                "com.hashicorp.nomad.task_name": "app",
                "maintainer": "NGINX Docker Maintainers <docker-maint@nginx.com>"
            },
            "StopSignal": "SIGQUIT"
        },
        "NetworkSettings": {
            "Bridge": "",
            "SandboxID": "",
            "SandboxKey": "",
            "Ports": {},
            "HairpinMode": false,
            "LinkLocalIPv6Address": "",
            "LinkLocalIPv6PrefixLen": 0,
            "SecondaryIPAddresses": null,
            "SecondaryIPv6Addresses": null,
            "EndpointID": "",
            "Gateway": "",
            "GlobalIPv6Address": "",
            "GlobalIPv6PrefixLen": 0,
            "IPAddress": "",
            "IPPrefixLen": 0,
            "IPv6Gateway": "",
            "MacAddress": "",
            "Networks": {}
        }
    }
]

</details>

<details>

<summary>network namespace on the host</summary>

```
root@idea:~# nsenter -n -t 2874269 ip addr
1: lo: <LOOPBACK,UP,LOWER_UP> mtu 65536 qdisc noqueue state UNKNOWN group default qlen 1000
    link/loopback 00:00:00:00:00:00 brd 00:00:00:00:00:00
    inet 127.0.0.1/8 scope host lo
       valid_lft forever preferred_lft forever
    inet6 ::1/128 scope host
       valid_lft forever preferred_lft forever
3: eth0@if368: <BROADCAST,MULTICAST,UP,LOWER_UP> mtu 1500 qdisc noqueue state UP group default
    link/ether 36:f6:8a:e8:75:01 brd ff:ff:ff:ff:ff:ff link-netnsid 0
    inet 172.26.64.109/20 brd 172.26.79.255 scope global eth0
       valid_lft forever preferred_lft forever
    inet6 fe80::34f6:8aff:fee8:7501/64 scope link
       valid_lft forever preferred_lft forever
```

```
root@idea:~# nsenter -n -t 2874269 ip route
default via 172.26.64.1 dev eth0
172.26.64.0/20 dev eth0 proto kernel scope link src 172.26.64.109
```

</details>

When doing a wget from the busybox to the nginx, we should see:

```
 172.26.64.45    [make request]->   172.26.64.109
 172.26.64.109   [answer]->         172.26.64.45
```

<details>

<summary>tcp dump on the veth while trying to reach nginx on same host</summary>

```
root@idea:~# tcpdump -i vethf3ef4d2c -n
tcpdump: verbose output suppressed, use -v[v]... for full protocol decode
listening on vethf3ef4d2c, link-type EN10MB (Ethernet), snapshot length 262144 bytes
09:15:17.733927 IP 172.26.64.45.55660 > 172.26.64.109.80: Flags [S], seq 2522871170, win 64240, options [mss 1460,sackOK,TS val 3219758274 ecr 0,nop,wscale 7], length 0
09:15:17.733957 IP 172.26.64.109.80 > 172.26.64.45.55660: Flags [S.], seq 1391756725, ack 2522871171, win 65160, options [mss 1460,sackOK,TS val 1243893975 ecr 3219758274,nop,wscale 7],
length 0
09:15:17.733976 IP 172.26.64.45.55660 > 172.26.64.109.80: Flags [R], seq 2522871171, win 0, length 0
09:15:18.741205 IP 172.26.64.45.55660 > 172.26.64.109.80: Flags [S], seq 2522871170, win 64240, options [mss 1460,sackOK,TS val 3219759282 ecr 0,nop,wscale 7], length 0
09:15:18.741246 IP 172.26.64.109.80 > 172.26.64.45.55660: Flags [S.], seq 1407495583, ack 2522871171, win 65160, options [mss 1460,sackOK,TS val 1243894983 ecr 3219759282,nop,wscale 7],
length 0
09:15:18.741270 IP 172.26.64.45.55660 > 172.26.64.109.80: Flags [R], seq 2522871171, win 0, length 0
09:15:20.757194 IP 172.26.64.45.55660 > 172.26.64.109.80: Flags [S], seq 2522871170, win 64240, options [mss 1460,sackOK,TS val 3219761298 ecr 0,nop,wscale 7], length 0
09:15:20.757223 IP 172.26.64.109.80 > 172.26.64.45.55660: Flags [S.], seq 1438995280, ack 2522871171, win 65160, options [mss 1460,sackOK,TS val 1243896999 ecr 3219761298,nop,wscale 7],
length 0
09:15:20.757236 IP 172.26.64.45.55660 > 172.26.64.109.80: Flags [R], seq 2522871171, win 0, length 0

```

</details>

<details>

<summary>tcp dump on the veth while trying to reach nginx on a differet host</summary>

```
root@august:~# tcpdump -i veth00d53b96 -n
tcpdump: verbose output suppressed, use -v[v]... for full protocol decode
listening on veth00d53b96, link-type EN10MB (Ethernet), snapshot length 262144 bytes
09:17:15.069804 IP 10.0.2.4.42586 > 172.26.64.105.80: Flags [S], seq 770959775, win 64240, options [mss 1460,sackOK,TS val 1848336537 ecr 0,nop,wscale 7], length 0
09:17:15.069886 IP 172.26.64.105.80 > 10.0.2.4.42586: Flags [S.], seq 262196534, ack 770959776, win 65160, options [mss 1460,sackOK,TS val 1845536190 ecr 1848336537,nop,wscale 7], length 0
09:17:15.070557 IP 10.0.2.4.42586 > 172.26.64.105.80: Flags [.], ack 1, win 502, options [nop,nop,TS val 1848336538 ecr 1845536190], length 0
09:17:15.070907 IP 10.0.2.4.42586 > 172.26.64.105.80: Flags [P.], seq 1:78, ack 1, win 502, options [nop,nop,TS val 1848336538 ecr 1845536190], length 77: HTTP: GET / HTTP/1.1
09:17:15.070960 IP 172.26.64.105.80 > 10.0.2.4.42586: Flags [.], ack 78, win 509, options [nop,nop,TS val 1845536191 ecr 1848336538], length 0
09:17:15.071436 IP 172.26.64.105.80 > 10.0.2.4.42586: Flags [P.], seq 1:234, ack 78, win 509, options [nop,nop,TS val 1845536192 ecr 1848336538], length 233: HTTP: HTTP/1.1 200 OK
09:17:15.071673 IP 172.26.64.105.80 > 10.0.2.4.42586: Flags [FP.], seq 234:849, ack 78, win 509, options [nop,nop,TS val 1845536192 ecr 1848336538], length 615: HTTP
09:17:15.071918 IP 10.0.2.4.42586 > 172.26.64.105.80: Flags [.], ack 234, win 501, options [nop,nop,TS val 1848336539 ecr 1845536192], length 0
09:17:15.072202 IP 10.0.2.4.42586 > 172.26.64.105.80: Flags [.], ack 850, win 501, options [nop,nop,TS val 1848336540 ecr 1845536192], length 0
09:17:15.072298 IP 10.0.2.4.42586 > 172.26.64.105.80: Flags [F.], seq 78, ack 850, win 501, options [nop,nop,TS val 1848336540 ecr 1845536192], length 0
09:17:15.072354 IP 172.26.64.105.80 > 10.0.2.4.42586: Flags [.], ack 79, win 509, options [nop,nop,TS val 1845536193 ecr 1848336540], length 0

```

</details>

## Package Counters

I was running this command on the host:

```bash
iptables -Z; iptables -vnL -t nat > out.1 ; sudo iptables -vnL > out.2; read; iptables -vnL -t nat > out.3 ; sudo iptables -vnL > out.4;
```

The files are attached for convenience:
[out.1.txt](https://github.com/user-attachments/files/18124031/out.1.txt)
[out.2.txt](https://github.com/user-attachments/files/18124033/out.2.txt)
[out.3.txt](https://github.com/user-attachments/files/18124034/out.3.txt)
[out.4.txt](https://github.com/user-attachments/files/18124035/out.4.txt)

This stood out (to me at least):

### Comparing the output of `iptables -vnL -t nat` (out.1 and out.3):

In `POSTROUTING`, there was no change in the CNI related to my nginx allocation (`CNI-a70cc46afdd56079a4bed82b`) but a bit of change in `CNI-2881c86f8d911ddd2c761df2` which link corresponds to `13bdeaab-5ada-a388-02df-2849ec244998`, the allocation for my box. Ok, this is POSTROUTING, dunno.

### Comparing the output of `iptables -vnL` (out.2 and out.4):

I need some help interpreting this correctly.

**Comment by mashedmonday** [comment]
I have just 
* added a brand new node to the cluster
* rebooted it
* deployed busybox and nginx
* and tried to reach nginx through busybox

Failed. Connection open, but stuck

**Comment by tgross** [comment]
Thanks for those detailed dumps @mashedmonday. I'm digging through them now but something that immediately has jumped out at me is the second bridge interface you've got here `br-c1756ee2cd13`. At first glance it looks like this is also wired up for docker, as it's in the `DOCKER-ISOLATION-STAGE-2` chain. Can you describe what's happening with that, and maybe check your routing tables for that bridge while I'm trying to figure out these iptables listings?

**Comment by mashedmonday** [comment]
I am currently on the road, but the setup is as this

* host box is a VPS at Hetzner
* eno1 is a NIC with public IP
* ens7p is a virtual LAN setup by Hetzner using VLAN (over eno1)

* nomad has the VLAN as primary (and only NIC) it binds to

Nothing special going on with routing


I can provide more i fo later this evening (UTC+1 here)

**Comment by mashedmonday** [comment]
You are right,for some reason there is a second docker bridge in `docker network ls`.

I have not created it to my knowledge, but as soon as i am on my desk i will get rid of it and see if that helps.

**Comment by mashedmonday** [comment]
Thanks again for taking the time to debug this with me.

I removed the extra docker bridge interface and reboot the machine twice, even purged the iptable rules and restarted again. Problem remains.

Maybe a fresh dump of the counters can help now that I no longer have the extra bridge:
[out.1.txt](https://github.com/user-attachments/files/18131481/out.1.txt)
[out.2.txt](https://github.com/user-attachments/files/18131483/out.2.txt)
[out.3.txt](https://github.com/user-attachments/files/18131484/out.3.txt)
[out.4.txt](https://github.com/user-attachments/files/18131485/out.4.txt)

Also, `docker network ls` (now, :shrug:):

```
root@alpha:~# docker network ls
NETWORK ID     NAME      DRIVER    SCOPE
07863d2212da   bridge    bridge    local
614fb6081d62   host      host      local
07867e8c7adf   none      null      local
```

> I'm getting towards the end of my week here as well. If you can report back on what you can about your Docker configuration, I can pick this back up next week.

Thanks for your assistance! Enjoy your weekend!

**Comment by mashedmonday** [comment]
You know what, I updated CNI plugin to version 1.6.1 and it started working again! 
🎉🎉🎉🎉🎉🎉🎉

Don't ask me why i was running on 0.8.5 :shrug: 

Case closed. I don't assume you would want to look any deeper into this, right?
Sorry if this caused any inconvenience for you and I much appreciate you taking them time to go through this with me.

**Comment by tgross** [comment]
Oof, sorry it took so long to figure out. We've seen a few bugs in CNI plugins, but they're very tricky to track down... for example, I'm having to work around that in https://github.com/hashicorp/nomad/pull/24658 where we can't restore allocations after host reboot reliably on anything less than CNI 1.3.0. This is a real problem because some of the various Linux distros are shipping _really_ old CNI plugin versions in their package manager.

> Case closed. I don't assume you would want to look any deeper into this, right?
> Sorry if this caused any inconvenience for you and I much appreciate you taking them time to go through this with me.

No worries! I am going to close this out, but it's going to inform a discussion I'll kick off next week around whether we should be making a documented recommendation to use more current CNI plugins than are in most folks' package managers.

**Comment by mashedmonday** [comment]
> No worries! I am going to close this out, but it's going to inform a discussion I'll kick off next week around whether we should be making a documented recommendation to use more current CNI plugins than are in most folks' package managers.

Yeah, that would be helpful. Maybe even have a check of the version on nomad startup (or at least give a log warning or so)

Anyhow, assistance much appreciate!
